{
  "$schema": "https://epos.dev/schema.json",
  "name": "[epos]",
  "slug": "shell",
  "version": "1.8",
  "description": "Web Extension Engine",
  "options": { "allowProjectsApi": true, "allowMissingModels": true },

  "assets": ["dist/icon.svg", "dist/icon.png"],
  "matches": ["https://app.epos.dev/*", "https://epos.dev/@learn"],
  "load": ["dist/fonts.css", "dist/gl.css", "dist/gl.js"],

  "hostPermissions": ["<allUrls>"],
  "permissions": [
    "background",
    "browsingData",
    "contextMenus",
    "cookies",
    "downloads",
    "notifications",
    "sidePanel",
    "storage"
  ]
}
