{
  "$schema": "https://epos.dev/schema.json",
  "name": "UnitBridge",
  "slug": "bridge-6",
  "assets": ["./public/logo.svg"],
  "targets": [
    {
      "matches": ["<popup>", "https://epos.dev/@bridge"],
      "load": ["./dist/app.js", "./dist/app.css"]
    },
    {
      "matches": "<background>",
      "load": ["./dist/background.js"]
    }
  ]
}
